Problem,Contest,Index,Tags,solvedCount
Decreasing String,1886,C,"implementation, strings",7693
Hard Design,1884,E,"greedy, implementation, math",123
Perfect Square,1881,C,"brute force, implementation",12104
Interactive Game with Coloring,1879,E,"brute force, constructive algorithms, dfs and similar, graphs, implementation, interactive, trees",989
wxhtzdy ORO Tree,1878,G,"binary search, bitmasks, brute force, data structures, dfs and similar, implementation, trees",841
Jellyfish and Game,1874,A,"brute force, games, greedy, implementation",12985
1D Eraser,1873,D,"greedy, implementation, two pointers",26698
Target Practice,1873,C,"implementation, math",27124
Short Sort,1873,A,"brute force, implementation",37148
Selling a Menagerie,1872,F,"dfs and similar, dsu, graphs, implementation, math",4746
The Corridor or There and Back Again,1872,B,"greedy, implementation",23666
Prefix Purchase,1870,D,"greedy, implementation, sortings",5470
Colorful Table,1870,C,"binary search, data structures, dp, implementation, math, two pointers",9117
LIS?,1868,F,"data structures, greedy, implementation",41
Flower-like Pseudotree,1868,D,"constructive algorithms, graphs, greedy, implementation, trees",197
Travel Plan,1868,C,"combinatorics, dp, implementation, math, trees",923
Candy Party (Hard Version),1868,B2,"bitmasks, constructive algorithms, dp, greedy, implementation, math",1983
Candy Party (Easy Version),1868,B1,"bitmasks, constructive algorithms, graphs, greedy, implementation, math",5484
Fill in the Matrix,1868,A,"constructive algorithms, implementation",9625
Cyclic Operations,1867,D,"brute force, constructive algorithms, dfs and similar, graphs, greedy, implementation",4537
Keen Tree Calculation,1866,K,"binary search, data structures, dp, geometry, graphs, implementation, trees",326
Magic Square,1864,G,"combinatorics, constructive algorithms, implementation",221
Exotic Queries,1864,F,"data structures, implementation, sortings",1145
Increasing and Decreasing,1864,A,"constructive algorithms, greedy, implementation, math",18495
MEX Repetition,1863,C,"implementation, math",11810
Channel,1863,A,"greedy, implementation",15995
Flower City Fence,1862,C,"binary search, data structures, implementation, sortings",17530
Gift Carpet,1862,A,"dp, greedy, implementation, strings",27409
Non-Intersecting Subpermutations,1861,E,"combinatorics, dp, implementation, math",1403
Queries for the Array,1861,C,"data structures, dfs and similar, implementation, strings, trees",8062
Evaluate RBS,1860,F,"data structures, geometry, implementation, math, sortings",230
Maximum Rounding,1857,B,"greedy, implementation, math",20349
PermuTree (hard version),1856,E2,"bitmasks, dfs and similar, dp, fft, greedy, implementation, math, trees",1122
Good Arrays,1856,B,"implementation, math",20799
Tales of a Sort,1856,A,implementation,24244
Vlad and the Mountains,1851,G,"binary search, data structures, dsu, graphs, implementation, sortings, trees, two pointers",2474
Prefix Permutation Sums,1851,D,"implementation, math",12682
The Third Letter,1850,H,"dfs and similar, dsu, graphs, greedy, implementation",6267
The Morning Star,1850,G,"combinatorics, data structures, geometry, implementation, math, sortings",9374
We Were Both Children,1850,F,"brute force, implementation, math, number theory",14339
Cardboard for Pictures,1850,E,"binary search, geometry, implementation, math",17644
Balanced Round,1850,D,"brute force, greedy, implementation, sortings",26503
Word on the Paper,1850,C,"implementation, strings",34643
Ten Words of Wisdom,1850,B,"implementation, sortings",35087
To My Critics,1850,A,"implementation, sortings",40883
Morning Sandwich,1849,A,"implementation, math",25155
Vika and Stone Skipping,1848,E,"brute force, implementation, math, number theory",659
Vika and the Bridge,1848,B,"binary search, data structures, greedy, implementation, math, sortings",11446
Triangle Platinum?,1847,E,"brute force, combinatorics, implementation, interactive, math, probabilities",289
Professor Higashikata,1847,D,"data structures, dsu, greedy, implementation, strings",3243
Rudolph and Mimic,1846,F,"constructive algorithms, implementation, interactive",2465
Rudolf and Snowflakes (hard version),1846,E2,"binary search, brute force, implementation, math",5845
Rudolf and Snowflakes (simple version),1846,E1,"brute force, implementation, math",13556
Rudolph and Tic-Tac-Toe,1846,B,"brute force, implementation, strings",24128
Rudolph and Cut the Rope ,1846,A,"implementation, math",29271
Boxes and Balls,1845,E,"dp, implementation, math",1140
Come Together,1845,B,"geometry, implementation, math",19148
Forbidden Integer,1845,A,"constructive algorithms, implementation, math, number theory",21684
Tree Weights,1844,G,"bitmasks, constructive algorithms, data structures, dfs and similar, implementation, math, matrices, number theory, trees",538
Particles,1844,C,"dp, greedy, implementation, math",13387
Keep it Beautiful,1841,B,implementation,18806
Character Blocking,1840,E,"data structures, hashing, implementation",6700
Cipher Shifer,1840,A,"implementation, strings, two pointers",30042
The Good Array,1839,A,"greedy, implementation, math",16227
Editorial for Two,1837,F,"binary search, data structures, greedy, implementation",1810
Destroyer,1836,A,"implementation, sortings",18514
Good Graph,1835,F,"bitmasks, dfs and similar, graph matchings, graphs, implementation",99
k-th equality,1835,A,"brute force, implementation, math",6695
MEX of LCM,1834,E,"binary search, data structures, implementation, math, number theory",1735
Survey in Class,1834,D,"brute force, data structures, greedy, implementation, sortings",3793
Ksyusha and Chinchilla,1833,G,"constructive algorithms, dfs and similar, dp, dsu, greedy, implementation, trees",4243
Ira and Flamenco,1833,F,"combinatorics, constructive algorithms, data structures, implementation, math, sortings, two pointers",5759
Musical Puzzle,1833,A,"implementation, strings",29567
Red-Blue Operations (Hard Version),1832,D2,"binary search, constructive algorithms, greedy, implementation, math",1665
Red-Blue Operations (Easy Version),1832,D1,"binary search, greedy, implementation, math",2585
Contrast Value,1832,C,"greedy, implementation",15536
Hits Different,1829,G,"data structures, dp, implementation, math",8001
The Lakes,1829,E,"dfs and similar, dsu, graphs, implementation",15808
Gold Rush,1829,D,"brute force, dfs and similar, dp, implementation",20969
Mr. Perfectly Fine,1829,C,"bitmasks, greedy, implementation",24339
Blank Space,1829,B,implementation,33757
Love Story,1829,A,"implementation, strings",37829
Walk the Runway,1826,E,"bitmasks, brute force, data structures, dp, graphs, implementation, sortings",1357
Trust Nobody,1826,A,"brute force, greedy, implementation, sortings",13048
LuoTianyi and the Show,1824,A,"greedy, implementation",9847
TubeTube Feed,1822,A,"brute force, implementation",22155
Tear It Apart,1821,C,"brute force, implementation, math, strings",12049
Yura's New Name,1820,A,"implementation, strings",15392
The Fox and the Complete Tree Traversal,1819,C,"constructive algorithms, dp, implementation, math, trees",1245
The Butcher,1819,B,"geometry, greedy, implementation, sortings, two pointers",3112
Politics,1818,A,"greedy, implementation",12058
Toy Machine,1817,D,"constructive algorithms, games, implementation",579
Sum Graph,1815,B,"brute force, constructive algorithms, graphs, implementation, interactive, shortest paths, trees",2578
Coins,1814,A,"implementation, math",22344
Colour Vision,1812,G,"*special, implementation",404
Was it Rated?,1812,B,"*special, *special, *special, brute force, implementation",4715
Is It Flower?,1811,F,"dfs and similar, graphs, implementation",1537
Umka and a Long Flight,1811,D,"constructive algorithms, implementation, math",6317
Conveyor Belts,1811,B,"implementation, math",18376
Traveling in Berland,1809,F,"binary search, data structures, graphs, greedy, implementation",639
Two Tanks,1809,E,"binary search, dp, implementation, math",713
Garland,1809,A,implementation,22523
Unlucky Numbers,1808,C,"brute force, dp, greedy, implementation",3224
Lucky Numbers,1808,A,"brute force, implementation",15923
Subsequence Addition (Hard Version),1807,G2,"bitmasks, dp, greedy, implementation, sortings",15770
Subsequence Addition (Easy Version),1807,G1,"brute force, data structures, dp, greedy, implementation, sortings",16282
Bouncy Ball,1807,F,"brute force, dfs and similar, implementation",5242
Interview,1807,E,"binary search, implementation, interactive",10410
Odd Queries,1807,D,"data structures, implementation",24089
Find and Replace,1807,C,"greedy, implementation, strings",26877
Plus or Minus,1807,A,implementation,45284
Survival of the Weakest (easy version),1805,F1,"binary search, brute force, implementation, math, sortings",682
Flow Control,1804,G,"data structures, dsu, implementation",164
Accommodation,1804,D,"brute force, dp, greedy, implementation",4148
Vaccination,1804,B,"greedy, implementation",13043
Settlement of Guinea Pigs,1802,B,"greedy, implementation, math",12065
Likes,1802,A,"greedy, implementation",14999
Symmetree,1800,G,"dfs and similar, hashing, implementation, trees",1694
Is It a Cat?,1800,A,"implementation, strings",27436
City Union,1799,E,"constructive algorithms, dfs and similar, dsu, geometry, greedy, implementation, math",1055
Recent Actions,1799,A,"data structures, greedy, implementation, math",10957
Three Sevens,1798,B,"brute force, data structures, greedy, implementation",14762
Showstopper,1798,A,"greedy, implementation, sortings",18571
Li Hua and Tree,1797,D,"brute force, data structures, dfs and similar, dp, implementation, trees",3270
Li Hua and Maze,1797,A,"constructive algorithms, flows, graphs, greedy, implementation",15864
Asterisk-Minor Template,1796,B,"implementation, strings",15094
Typical Interview Problem,1796,A,"brute force, implementation, strings",17906
Tea Tasting,1795,C,"binary search, data structures, implementation",10150
Two Towers,1795,A,"brute force, implementation, strings",22357
Labeling the Tree with Distances,1794,E,"data structures, dp, greedy, hashing, implementation, trees",874
Rebrending,1793,F,"brute force, data structures, divide and conquer, implementation",1108
Moscow Gorillas,1793,D,"binary search, dp, greedy, implementation, math, two pointers",5232
Prepend and Append,1791,C,"implementation, two pointers",35460
Following Directions,1791,B,"geometry, implementation",38148
Codeforces Checking,1791,A,"implementation, strings",46227
Premutation,1790,C,"brute force, implementation, math",21344
Polycarp and the Day of Pi,1790,A,"implementation, math, strings",33499
Serval and Brain Power,1789,F,"bitmasks, brute force, dp, greedy, implementation, strings",443
Serval and Music Game,1789,E,"brute force, dp, implementation, math, number theory",698
Serval and Shift-Shift-Shift,1789,D,"bitmasks, brute force, constructive algorithms, implementation",1465
Serval and Toxel's Arrays,1789,C,"combinatorics, dp, implementation, math",7327
Serval and Inversion Magic,1789,B,"brute force, implementation, strings, two pointers",14998
"XOR, Tree, and Queries",1788,F,"bitmasks, constructive algorithms, dfs and similar, dsu, graphs, greedy, implementation, trees",692
Sum of Two Numbers,1788,B,"constructive algorithms, greedy, implementation, math, probabilities",17751
One and Two,1788,A,"brute force, implementation, math",24367
Inverse Transformation,1787,F,"constructive algorithms, implementation, math",591
Game on Axis,1787,D,"combinatorics, dfs and similar, dsu, graphs, implementation",3055
Alternating Deck (hard version),1786,A2,implementation,10869
Non-alternating Deck (easy version),1786,A1,implementation,13207
Weighed Tree Radius,1783,G,"data structures, divide and conquer, implementation, trees",371
Different Arrays,1783,D,"brute force, dp, implementation",3796
Rectangle Shrinking,1781,E,"binary search, brute force, data structures, greedy, implementation, two pointers",1223
Equal Frequencies,1781,C,"brute force, constructive algorithms, greedy, implementation, sortings, strings",6345
Flip Flop Sum,1778,A,"greedy, implementation",22886
The Human Equation,1775,E,"greedy, implementation",2768
Gardener and the Capybaras (easy version),1775,A1,"brute force, constructive algorithms, implementation",18823
Magician and Pigs (Hard Version),1774,F2,"binary search, brute force, data structures, implementation",566
Magician and Pigs (Easy Version),1774,F1,"brute force, data structures, implementation",959
Same Count One,1774,D,"brute force, constructive algorithms, greedy, implementation, two pointers",6771
Interactive Factorial Guessing,1773,I,"brute force, games, implementation, interactive",413
BinCoin,1773,B,"binary search, divide and conquer, hashing, implementation, probabilities, trees",660
Gaining Rating,1772,G,"binary search, greedy, implementation, math, sortings, two pointers",1180
Copy of a Copy of a Copy,1772,F,"constructive algorithms, dfs and similar, graphs, implementation, sortings",2033
Matrix Rotation,1772,B,"brute force, implementation",26751
A+B?,1772,A,implementation,38688
Hossam and a Letter,1771,E,"brute force, dp, implementation, two pointers",613
Koxia and Game,1770,D,"constructive algorithms, data structures, dfs and similar, dsu, flows, games, graph matchings, graphs, implementation",3433
Копирование файлов I,1769,B1,"*special, brute force, implementation, math",1250
Elemental Decompress,1768,C,"constructive algorithms, greedy, implementation, sortings",12649
Cut the Triangle,1767,A,implementation,19683
Hamiltonian Wall,1766,C,"dp, implementation",12133
Notepad#,1766,B,implementation,18677
Extremely Round,1766,A,"brute force, implementation",21247
Project Manager,1765,L,"brute force, data structures, implementation",512
Infinite Chess,1765,I,"implementation, shortest paths",156
Hospital Queue,1765,H,"binary search, graphs, greedy, implementation",1066
Valid Bitonic Permutations,1763,D,"combinatorics, dp, implementation, math, number theory",1839
Incinerate,1763,B,"binary search, brute force, data structures, implementation, math, sortings",12858
Make Array Good,1762,B,"constructive algorithms, implementation, number theory, sortings",15300
Elimination of a Ring,1761,B,"constructive algorithms, greedy, implementation",12314
Challenging Valleys,1760,D,"implementation, two pointers",20384
Advantage,1760,C,"data structures, implementation, sortings",31830
Atilla's Favorite Problem,1760,B,"greedy, implementation, strings",37467
Medium Number,1760,A,"implementation, sortings",45870
Yes-Yes?,1759,A,"implementation, strings",26935
Complementary XOR,1750,C,"constructive algorithms, implementation",8703
Maximum Substring,1750,B,"brute force, greedy, implementation",15654
Indirect Sort,1750,A,"constructive algorithms, implementation, math",16376
Number Game,1749,C,"binary search, data structures, games, greedy, implementation",12246
Cowardly Rooks,1749,A,"greedy, implementation",21492
Zero-Sum Prefixes,1748,C,"brute force, data structures, dp, greedy, implementation",9476
Diverse Substrings,1748,B,"brute force, implementation, strings",13107
Olympiad Training,1746,G,"binary search, data structures, dp, flows, geometry, implementation, sortings",85
Permutation Operations,1746,C,"constructive algorithms, greedy, implementation, math",11553
Traffic Light,1744,C,"binary search, implementation, two pointers",21114
Even-Odd Increments ,1744,B,"implementation, math",21953
Number Replacement,1744,A,"greedy, implementation",25304
Password,1743,A,"brute force, combinatorics, implementation, math",25024
Stripes,1742,C,implementation,27904
Increasing,1742,B,"greedy, implementation, sortings",39655
Sum,1742,A,implementation,53554
Compare T-Shirt Sizes,1741,A,"implementation, implementation, strings",28318
Immobile Knight,1739,A,implementation,21699
Glory Addicts,1738,A,"greedy, implementation, sortings",13110
Ela and the Wiring Wizard,1737,D,"brute force, dp, graphs, greedy, implementation, shortest paths",1735
Ela and Crickets,1737,C,"constructive algorithms, games, implementation, math",5248
Ela's Fitness and the Luxury Number,1737,B,"binary search, implementation, math",8715
Ela Sorting Books,1737,A,"greedy, implementation, strings",9631
Equal Binary Subsequences,1736,D,"constructive algorithms, geometry, greedy, implementation, strings",2256
Phase Shift,1735,C,"dfs and similar, dsu, graphs, greedy, implementation, strings",9043
Balance (Easy version),1732,D1,"brute force, data structures, implementation, number theory",7502
Sheikh (Hard Version),1732,C2,"binary search, bitmasks, brute force, greedy, implementation, two pointers",2266
Ugu,1732,B,"brute force, dp, greedy, implementation",13197
Bestie,1732,A,"brute force, combinatorics, constructive algorithms, implementation, math, number theory",13649
Meeting on the Line,1730,B,"binary search, geometry, greedy, implementation, math, ternary search",10783
Colored Balls: Revisited,1728,A,"brute force, greedy, implementation, sortings",23836
Mainak and the Bleeding Polygon,1726,H,"binary search, geometry, implementation, math",72
L-shapes,1722,F,"dfs and similar, implementation",6024
Counting Rectangles,1722,E,"brute force, data structures, dp, implementation",8931
Word Game,1722,C,"data structures, implementation",27153
Colourblindness,1722,B,implementation,38972
Spell Check,1722,A,implementation,41245
Deadly Laser,1721,B,implementation,20534
Image,1721,A,"greedy, implementation",25710
Misha and Paintings,1720,E,"constructive algorithms, data structures, greedy, implementation, math",693
Corners,1720,C,"greedy, implementation",15435
Fighting Tournament,1719,C,"binary search, data structures, implementation, two pointers",12116
Impressionism,1718,E,"constructive algorithms, graphs, implementation, math",95
Fibonacci Strings,1718,B,"greedy, implementation, math, number theory",2683
Madoka and The First Session,1717,F,"constructive algorithms, flows, graph matchings, graphs, implementation",472
Madoka and Underground Competitions,1717,B,"constructive algorithms, implementation",14069
Robot in a Hallway,1716,C,"data structures, dp, greedy, implementation, ternary search",3821
Monoblock,1715,C,"combinatorics, data structures, implementation, math",7913
Build a Tree and That Is It,1714,F,"constructive algorithms, implementation, trees",2849
Remove Prefix,1714,B,"data structures, greedy, implementation",27539
Everyone Loves to Sleep,1714,A,"implementation, math",26582
Traveling Salesman Problem,1713,A,"geometry, greedy, implementation",21158
Wonderful Permutation,1712,A,"greedy, implementation",23239
Rain,1710,B,"binary search, brute force, data structures, geometry, greedy, implementation, math",2246
Recover an RBS,1709,C,"constructive algorithms, greedy, implementation, strings",8015
Also Try Minecraft,1709,B,"data structures, dp, implementation",20868
Three Doors,1709,A,"brute force, greedy, implementation, math",27925
Difference Array,1707,B,"brute force, data structures, implementation, sortings",5257
Doremy's IQ,1707,A,"binary search, constructive algorithms, greedy, implementation",12038
Qpwoeirut And The City,1706,C,"dp, flows, greedy, implementation",13563
Mark and His Unfinished Essay,1705,C,"brute force, implementation",12323
Mark the Dust Sweeper,1705,B,"constructive algorithms, greedy, implementation",21101
Count Seconds,1704,E,"brute force, constructive algorithms, dp, graphs, implementation, math",2118
Magical Array,1704,D,"constructive algorithms, hashing, implementation, math",4640
Virus,1704,C,"greedy, implementation, sortings",12963
Luke is a Foodie,1704,B,"brute force, greedy, implementation",14898
Mirror Grid,1703,E,implementation,15164
Cypher,1703,C,"brute force, implementation, strings",31827
ICPC Balloons,1703,B,"data structures, implementation",40144
YES or YES?,1703,A,"brute force, implementation, strings",53194
Points,1701,F,"combinatorics, data structures, implementation, math, matrices",813
Schedule Management,1701,C,"binary search, greedy, implementation, two pointers",14359
Grass Field,1701,A,implementation,24978
Palindromic Numbers ,1700,B,"constructive algorithms, implementation, math",17493
Equal Reversal,1698,F,"constructive algorithms, graphs, implementation, math",516
Rising Sand,1698,B,"constructive algorithms, greedy, implementation",20297
Too Many Constraints,1697,F,"2-sat, constructive algorithms, graphs, implementation",417
Coloring,1697,E,"brute force, combinatorics, constructive algorithms, dp, geometry, graphs, greedy, implementation, math",1080
awoo's Favorite Problem,1697,C,"binary search, constructive algorithms, data structures, greedy, implementation, strings, two pointers",13137
Parkway Walk,1697,A,"greedy, implementation",24796
Maximum Product?,1696,H,"brute force, combinatorics, dp, greedy, implementation, math, two pointers",126
Fishingprince Plays With Array,1696,C,"constructive algorithms, greedy, implementation, math",10824
Creep,1694,A,"greedy, implementation",21511
Binary Deque,1692,E,"binary search, implementation, two pointers",17484
The Clock,1692,D,"brute force, implementation",17543
Where's the Bishop?,1692,C,implementation,30253
Marathon,1692,A,implementation,51126
Max GEQ Sum,1691,D,"binary search, constructive algorithms, data structures, divide and conquer, implementation, two pointers",5004
Shoe Shuffling,1691,B,"constructive algorithms, greedy, implementation, two pointers",19721
Black and White Stripe,1690,D,"implementation, two pointers",23595
Restoring the Duration of Tasks,1690,C,"data structures, greedy, implementation",24369
Array Decrements,1690,B,"greedy, implementation",23786
Lex String,1689,A,"brute force, greedy, implementation, sortings, two pointers",15967
Cute number,1687,D,"binary search, brute force, data structures, dsu, implementation, math",517
Linguistics,1685,B,"greedy, implementation, sortings, strings",2969
Column Swapping,1684,C,"brute force, constructive algorithms, greedy, implementation, sortings",11475
Circular Spanning Tree,1682,D,"constructive algorithms, implementation, trees",3009
LIS or Reverse LIS?,1682,C,"constructive algorithms, greedy, implementation, math",13321
Double Sort,1681,C,"implementation, sortings",16069
Card Trick,1681,B,"implementation, math",19362
Robots,1680,B,implementation,17722
Rooks Defenders,1679,C,"data structures, implementation",9356
Stone Age Problem,1679,B,"data structures, implementation",15498
Tokitsukaze and Good 01-String (hard version),1678,B2,"dp, greedy, implementation",6083
Tokitsukaze and Good 01-String (easy version),1678,B1,implementation,15351
Tokitsukaze and All Zero Sequence,1678,A,implementation,17595
Tokitsukaze and Meeting,1677,B,"data structures, implementation, math",3791
Longest Strike,1676,F,"data structures, greedy, implementation, sortings, two pointers",14427
X-Sum,1676,D,"brute force, greedy, implementation",21979
Most Similar Words,1676,C,"brute force, greedy, implementation, implementation, math, strings",26727
Lucky?,1676,A,implementation,49235
Vertical Paths,1675,D,"graphs, implementation, trees",11730
Detective Task,1675,C,implementation,16765
Make It Increasing,1675,B,"greedy, implementation",22310
Desktop Rearrangement,1674,F,"data structures, greedy, implementation",4568
A-B-C Sort,1674,D,"constructive algorithms, implementation, sortings",14860
Infinite Replacement,1674,C,"combinatorics, implementation, strings",21556
Cyclic Rotation,1672,D,"constructive algorithms, greedy, implementation, two pointers",5696
Unequal Array,1672,C,"constructive algorithms, greedy, implementation",12437
I love AAAB,1672,B,"constructive algorithms, implementation",15162
Log Chopping,1672,A,"games, implementation, math",15463
String Building,1671,A,implementation,19738
Very Suspicious,1670,D,"binary search, brute force, geometry, greedy, implementation, math",4708
Where is the Pizza?,1670,C,"data structures, dfs and similar, dsu, graphs, implementation, math",8882
Dorms War,1670,B,"brute force, implementation, strings",11992
Prof. Slim,1670,A,"greedy, implementation, sortings",14898
Fall Down,1669,G,"dfs and similar, implementation",15765
Colorful Stamp,1669,D,implementation,19423
Odd/Even Increments,1669,C,"greedy, greedy, implementation, math",30158
Triple,1669,B,"implementation, sortings",35628
Division?,1669,A,implementation,48221
Direction Change,1668,A,"implementation, math",15870
Yin Yang,1667,F,implementation,77
Fancy Stack,1666,F,"combinatorics, dp, implementation",994
MinimizOR,1665,E,"bitmasks, brute force, data structures, divide and conquer, greedy, implementation, two pointers",1294
Are You Safe?,1663,E,"*special, implementation",509
Pōja Verdon,1663,C,"*special, implementation, math",5418
Mike's Sequence,1663,B,"*special, divide and conquer, implementation, math",3197
Circular Maze,1662,O,"brute force, dfs and similar, graphs, implementation",1135
Ice Cream Shop,1662,I,"brute force, implementation, sortings",1760
Antennas,1662,F,"data structures, dfs and similar, graphs, graphs, implementation, implementation, shortest paths, shortest paths",863
Evolution of Weasels,1662,D,"greedy, implementation, strings",1497
Organizing SWERC,1662,A,"brute force, implementation",3851
Promising String (hard version),1660,F2,"data structures, implementation, math, strings",2438
Promising String (easy version),1660,F1,"brute force, implementation, math, strings",6598
Matrix and Shifts,1660,E,"brute force, constructive algorithms, greedy, implementation",6602
Maximum Product Strikes Back,1660,D,"brute force, implementation, math, two pointers",7540
Reverse Sort Sum,1659,D,"constructive algorithms, data structures, greedy, implementation, math, two pointers",3663
Line Empire,1659,C,"binary search, brute force, dp, greedy, implementation, math",8868
