Problem,Contest,Index,Tags,solvedCount
Acacius and String,1379,A,"brute force, implementation, strings",11236
Cyclic Shifts Sorting,1374,F,"brute force, constructive algorithms, implementation, sortings",1222
Reading Books (hard version),1374,E2,"data structures, greedy, implementation, sortings, ternary search, two pointers",872
Maximum Sum on Even Positions,1373,D,"divide and conquer, dp, greedy, implementation",14356
Donut Shops,1373,A,"greedy, implementation, math",24561
Omkar and Completion,1372,A,"constructive algorithms, implementation",30617
Raging Thunder,1371,F,"data structures, divide and conquer, implementation",484
Grid-00100,1371,D,"constructive algorithms, greedy, implementation",12564
A Cookie for You,1371,C,"greedy, implementation, math",19565
Odd-Even Subsequence,1370,D,"binary search, dp, dsu, greedy, implementation",8680
Maximum GCD,1370,A,"greedy, implementation, math, number theory",44931
DeadLee,1369,E,"data structures, dfs and similar, greedy, implementation, sortings",1962
AccurateLee,1369,B,"greedy, implementation, strings",23064
Lamps on a Circle,1368,F,"games, implementation, interactive, math",806
C+=,1368,A,"brute force, greedy, implementation, math",34272
Task On The Board,1367,D,"constructive algorithms, greedy, implementation, sortings",7755
Short Substrings,1367,A,"implementation, strings",51096
Swaps Again,1365,F,"constructive algorithms, implementation, sortings",4190
Solve The Maze,1365,D,"constructive algorithms, dfs and similar, dsu, graphs, greedy, implementation, shortest paths",15073
Rotation Matching,1365,C,"constructive algorithms, data structures, greedy, implementation",21318
Trouble Sort,1365,B,"constructive algorithms, implementation",24990
Matrix Game,1365,A,"games, greedy, implementation",23063
Ehab's Last Corollary,1364,D,"constructive algorithms, dfs and similar, graphs, greedy, implementation, trees",3861
Guess The Maximums,1363,D,"binary search, implementation, interactive, math",3722
Subsequence Hate,1363,B,"implementation, strings",21925
Odd Selection,1363,A,"brute force, implementation, math",32527
Johnny and Ancient Computer,1362,A,implementation,21447
Johnny and New Toy,1361,F,"data structures, implementation, math",128
Johnny and James,1361,D,"greedy, implementation, math, trees",299
Johnny and Grandmaster,1361,B,"greedy, implementation, math, sortings",3325
Polygon,1360,E,"dp, graphs, implementation, shortest paths",23300
Yet Another Yet Another Task,1359,D,"data structures, dp, implementation, two pointers",8536
New Theatre Square,1359,B,"brute force, dp, greedy, implementation, two pointers",26205
Tasty Cookie,1358,F,"binary search, constructive algorithms, greedy, implementation",419
Are You Fired?,1358,E,"constructive algorithms, data structures, greedy, implementation",2006
The Best Vacation,1358,D,"binary search, brute force, greedy, implementation, two pointers",7778
Count Triangles,1355,C,"binary search, implementation, math, two pointers",9874
Sequence with Digits,1355,A,"brute force, implementation, math",24459
Ternary String,1354,B,"binary search, dp, implementation, two pointers",27440
Special Elements,1352,E,"brute force, implementation, two pointers",17736
"Alice, Bob and Candies",1352,D,implementation,23209
Sum of Round Numbers,1352,A,"implementation, math",63538
Skier,1351,C,"data structures, implementation",7965
Square?,1351,B,"brute force, implementation, math",15740
A+B (Trial Problem),1351,A,implementation,21207
Orac and Game of Life,1349,C,"dfs and similar, graphs, implementation, shortest paths",4129
Phoenix and Science,1348,D,"binary search, constructive algorithms, greedy, implementation, math",8241
Restore the Permutation by Sorted Segments,1343,F,"brute force, constructive algorithms, data structures, greedy, implementation",1192
Nastya and Door,1341,B,"greedy, implementation",18507
Nastya and Strange Generator,1340,A,"brute force, data structures, greedy, implementation",13005
Filling Diamonds,1339,A,"brute force, dp, implementation, math",29891
Kana and Dragon Quest game,1337,B,"greedy, implementation, math",31675
Anti-Sudoku,1335,D,"constructive algorithms, implementation",25694
Two Teams Composing,1335,C,"binary search, greedy, implementation, sortings",31753
Minimum Euler Cycle,1334,D,"constructive algorithms, graphs, greedy, implementation",6844
Level Statistics,1334,A,"implementation, math",22180
Kate and imperfection,1333,F,"greedy, implementation, math, number theory, sortings, two pointers",3824
Challenges in school №41,1333,D,"brute force, constructive algorithms, games, graphs, greedy, implementation, sortings",3576
Eugene and an array,1333,C,"binary search, data structures, implementation, two pointers",11799
Kind Anton,1333,B,"greedy, implementation",20903
K-Complete Word,1332,C,"dfs and similar, dsu, greedy, implementation, strings",15054
Exercising Walk,1332,A,"greedy, implementation, math",18871
Jordan Smiley,1331,E,"*special, dfs and similar, geometry, implementation",1177
Again?,1331,D,"*special, implementation",11757
Dreamoon Likes Permutations,1330,B,"implementation, math",13540
Dreamoon and Ranking Collection,1330,A,implementation,18172
Drazil Likes Heap,1329,C,"constructive algorithms, data structures, greedy, implementation",1447
Dreamoon Likes Coloring,1329,A,"constructive algorithms, greedy, implementation, math",8566
Ternary XOR,1328,C,"greedy, implementation",28201
K-th Beautiful String,1328,B,"binary search, brute force, combinatorics, implementation, math",26933
Game with Chips,1327,C,"constructive algorithms, implementation",12790
Maximums,1326,B,"implementation, math",22953
CopyCopyCopyCopyCopy,1325,B,"greedy, implementation",33504
Sleeping Schedule,1324,E,"dp, implementation",11642
Frog Jumps,1324,C,"binary search, data structures, dfs and similar, greedy, implementation",25674
Yet Another Tetris Problem,1324,A,"implementation, number theory",24637
Count Subrectangles,1323,B,"binary search, greedy, implementation",8235
Even Subset Sum Problem,1323,A,"brute force, dp, greedy, implementation",18887
Nash Matrix,1316,D,"constructive algorithms, dfs and similar, graphs, implementation",3100
String Modification,1316,B,"brute force, constructive algorithms, implementation, sortings, strings",10758
Grade Allocation,1316,A,implementation,18050
Dead Pixel,1315,A,implementation,11567
Happy New Year,1313,D,"bitmasks, dp, implementation",998
Different Rules,1313,B,"constructive algorithms, greedy, implementation, math",6305
Fast Food Restaurant,1313,A,"brute force, greedy, implementation",14901
Adding Powers,1312,C,"bitmasks, greedy, implementation, math, number theory, ternary search",15255
Moving Points,1311,F,"data structures, divide and conquer, implementation, sortings",3684
Add Odd or Subtract Even,1311,A,"greedy, implementation, math",38989
Double Elimination,1310,B,"dp, implementation",479
Cow and Treats,1307,E,"binary search, combinatorics, dp, greedy, implementation, math",1042
Cow and Haybales,1307,A,"greedy, implementation",14535
Kuroni and the Score Distribution,1305,E,"constructive algorithms, greedy, implementation, math",2766
Air Conditioner,1304,C,"dp, greedy, implementation, sortings, two pointers",15029
Longest Palindrome,1304,B,"brute force, constructive algorithms, greedy, implementation, strings",17049
Number of Components,1303,F,"dsu, implementation",482
Perfect Keyboard,1303,C,"dfs and similar, greedy, implementation",11499
Erasing Zeroes,1303,A,"implementation, strings",28549
Super Jaber,1301,F,"dfs and similar, graphs, implementation, shortest paths",997
Nanosoft,1301,E,"binary search, data structures, dp, implementation",1161
Time to Run,1301,D,"constructive algorithms, graphs, implementation",3689
Three Strings,1301,A,"implementation, strings",18762
Assigning to Classes,1300,B,"greedy, implementation, sortings",21031
Non-zero,1300,A,"implementation, math",20375
Movie Fan,1297,F,"*special, data structures, greedy, implementation, sortings",105
Cartoons,1297,B,"*special, implementation, sortings",389
Likes Display,1297,A,"*special, implementation",851
Yet Another Walking Robot,1296,C,"data structures, implementation",13977
Obtain a Permutation,1294,E,"greedy, implementation, math",4507
MEX maximizing,1294,D,"data structures, greedy, implementation, math",10883
Collecting Packages,1294,B,"implementation, sortings",20591
ConneR and the A.R.C. Markland-N,1293,A,"binary search, brute force, implementation",14627
Aroma's Search,1292,B,"brute force, constructive algorithms, geometry, greedy, implementation",5806
NEKO's Maze Game,1292,A,"data structures, dsu, implementation",12714
Array Sharpening,1291,B,"greedy, implementation",13459
Mind Control,1290,A,"brute force, data structures, implementation",8138
Hyperset,1287,B,"brute force, data structures, implementation",8951
Angry Students,1287,A,"greedy, implementation",19625
Harry The Potter,1286,F,"brute force, constructive algorithms, dp, fft, implementation, math",204
Just Eat It!,1285,B,"dp, greedy, implementation",19551
New Year and Ascent Sequence,1284,B,"binary search, combinatorics, data structures, dp, implementation, sortings",10352
New Year and Naming,1284,A,"implementation, strings",17536
Temporarily unavailable,1282,A,"implementation, math",14206
Suffix Three,1281,A,implementation,17352
Beingawesomeism,1280,B,"implementation, math",3620
Cut and Paste,1280,A,"implementation, math",4964
Stack of Presents,1279,C,"data structures, implementation",11075
Verse For Santa,1279,B,"binary search, brute force, implementation",13036
Berry Jam,1278,C,"data structures, dp, greedy, implementation",7336
Shuffle Hashing,1278,A,"brute force, implementation, strings",15102
Let's Play the Words?,1277,D,"data structures, hashing, implementation, math",2867
"Happy Birthday, Polycarp!",1277,A,implementation,12616
Yet Another Broken Keyboard,1272,C,"combinatorics, dp, implementation",23327
Snow Walking Robot,1272,B,"constructive algorithms, greedy, implementation",13080
Portals,1271,D,"data structures, dp, greedy, implementation, sortings",2575
Shawarma Tent,1271,C,"brute force, geometry, greedy, implementation",9980
Long Beautiful Integer,1268,A,"constructive algorithms, greedy, implementation, strings",8101
Just Arrange the Icons,1267,J,"greedy, implementation, math",2405
Intriguing Selection,1267,I,"brute force, constructive algorithms, implementation, interactive, sortings",628
Spaceship Solitaire,1266,E,"data structures, greedy, implementation",1964
Decreasing Debts,1266,D,"constructive algorithms, data structures, graphs, greedy, implementation, math, two pointers",3293
Beautiful Numbers,1265,B,"data structures, implementation, math, two pointers",12015
Beautiful Regional Contest,1264,A,"greedy, implementation",9651
Editor,1263,E,"data structures, implementation",2464
PIN Codes,1263,B,"greedy, implementation",10853
Dominated Subarray,1257,C,"greedy, implementation, sortings, strings, two pointers",15115
League of Leesins,1255,C,"constructive algorithms, implementation",6366
Fridge Lockers,1255,B,"graphs, implementation",11360
Feeding Chicken,1254,A,"constructive algorithms, greedy, implementation",4860
Silly Mistake,1253,B,"greedy, implementation",10653
Single Push,1253,A,implementation,17075
Twin Buildings,1252,H,"greedy, implementation",2513
Even Path,1252,C,"data structures, implementation",3520
Data Center,1250,F,"brute force, implementation",6971
The Coronation,1250,E,"graphs, implementation",776
Berstagram,1250,A,implementation,3945
Good Numbers (easy version),1249,C1,"brute force, greedy, implementation",14527
The World Is Just a Programming Task (Easy Version),1248,D1,"brute force, dp, greedy, implementation",2237
Chips,1244,F,"constructive algorithms, implementation",1271
Paint the Tree,1244,D,"brute force, constructive algorithms, dp, graphs, implementation, trees",6921
Rooms and Staircases,1244,B,"brute force, implementation",14529
Maximum Square,1243,A,implementation,14943
"Swiper, no swiping!",1239,F,"graphs, implementation",216
Turtle,1239,E,"dp, implementation",776
Queue in the Train,1239,C,"data structures, greedy, implementation",1276
The World Is Just a Programming Task (Hard Version),1239,B,implementation,932
Balanced Playlist,1237,D,"binary search, data structures, implementation",3634
Balanced Removals (Harder),1237,C2,"binary search, constructive algorithms, divide and conquer, greedy, implementation, sortings",4007
Balanced Rating Changes,1237,A,"implementation, math",17619
Alice and the Doll,1236,D,"brute force, data structures, greedy, implementation",1616
Labs,1236,C,"constructive algorithms, greedy, implementation",9588
Pipes,1234,C,"dp, implementation",11842
Social Network (hard version),1234,B2,"data structures, implementation",15899
Social Network (easy version),1234,B1,implementation,17790
Ania and Minimizing,1230,B,"greedy, implementation",17772
Dawid and Bags of Candies,1230,A,"brute force, implementation",20407
One Node is Gone,1228,F,"constructive algorithms, implementation, trees",402
Complete Tripartite,1228,D,"brute force, constructive algorithms, graphs, hashing, implementation",4847
Filling the Grid,1228,B,"implementation, math",11106
Distinct Digits,1228,A,"brute force, implementation",20409
TV Subscriptions (Hard Version),1225,B2,"implementation, two pointers",9698
TV Subscriptions (Easy Version),1225,B1,implementation,11349
Cards,1220,A,"implementation, sortings, strings",27552
Harvester,1219,G,implementation,574
Periodic integer number,1219,C,"implementation, strings",1654
Sum Queries?,1217,E,"data structures, greedy, implementation, math",1558
Shooting,1216,B,"greedy, implementation, sortings",17476
The Number of Products,1215,B,"combinatorics, dp, implementation",11468
Yellow Cards,1215,A,"greedy, implementation, math",11027
Unstable String Sort,1213,F,"data structures, dfs and similar, dsu, graphs, greedy, implementation, strings",2171
Equalizing by Division (easy version),1213,D1,"brute force, implementation",10654
Bad Prices,1213,B,"data structures, implementation",24086
kotlinkotlinkotlinkotlin...,1211,F,"*special, graphs, implementation, strings",111
Traveling Around the Golden Ring of Berland,1211,B,"*special, implementation",691
Three Problems,1211,A,"*special, implementation",1138
Into Blocks (easy version),1209,G1,"data structures, dsu, greedy, implementation, two pointers",2581
Paint the Digits,1209,C,"constructive algorithms, greedy, implementation",7067
Koala and Lights,1209,B,"implementation, math, number theory",7781
Paint the Numbers,1209,A,"greedy, implementation, math",11565
Red Blue Tree,1208,H,"data structures, implementation, trees",117
Let Them Slide,1208,E,"data structures, implementation",1905
Restore Permutation,1208,D,"binary search, data structures, greedy, implementation",4509
Uniqueness,1208,B,"binary search, brute force, implementation, two pointers",9737
Remainder Problem,1207,F,"brute force, data structures, implementation",4165
Square Filling,1207,B,"constructive algorithms, greedy, implementation",12602
There Are Two Types Of Burgers,1207,A,"brute force, greedy, implementation, math",20764
Make Product Equal One,1206,B,"dp, implementation",24923
Palindromic Paths,1205,C,"implementation, interactive",1080
Remove the Substring (hard version),1203,D2,"binary search, greedy, implementation, two pointers",6721
Remove the Substring (easy version),1203,D1,"greedy, implementation",8082
Common Divisors,1203,C,"implementation, math",18486
Circle of Students,1203,A,implementation,16019
You Are Given Some Letters...,1202,F,"binary search, implementation, math",355
You Are Given a WASD-string...,1202,C,"brute force, data structures, dp, greedy, implementation, math, strings",2209
Treasure Hunting,1201,D,"binary search, dp, greedy, implementation",2027
Important Exam,1201,A,"implementation, strings",14529
Graph Traveler,1200,F,"brute force, data structures, dfs and similar, dp, graphs, implementation, math, number theory",831
Compress Words,1200,E,"brute force, hashing, implementation, string suffix structures, strings",6290
White Lines,1200,D,"brute force, data structures, dp, implementation, two pointers",3735
Hotelier,1200,A,"brute force, data structures, implementation",19513
City Day,1199,A,implementation,13507
Pillars,1197,B,"greedy, implementation",13210
Connected Component on a Chessboard,1196,E,"constructive algorithms, implementation",3384
RGB Substring (hard version),1196,D2,"data structures, dp, implementation, two pointers",8953
RGB Substring (easy version),1196,D1,implementation,9884
Robot Breakout,1196,C,implementation,8838
From S To T,1194,C,"implementation, strings",12435
Yet Another Crosses Problem,1194,B,implementation,9815
Tokitsukaze and Mahjong,1191,B,"brute force, implementation",9245
Tokitsukaze and Discard Items,1190,A,"implementation, two pointers",8960
Candies!,1189,C,"data structures, dp, implementation, math",9988
Add on a Tree: Revolution,1188,A2,"constructive algorithms, dfs and similar, implementation, trees",997
Vasya And Array,1187,C,"constructive algorithms, greedy, implementation",5892
Letters Shop,1187,B,"binary search, implementation, strings",11550
Vus the Cossack and a Graph,1186,F,"dfs and similar, graphs, greedy, implementation",721
Vus the Cossack and a Field,1186,E,"divide and conquer, implementation, math",544
Vus the Cossack and Strings,1186,C,"implementation, math",5685
Vus the Cossack and a Contest,1186,A,implementation,34124
Polycarp and Snakes,1185,E,"brute force, implementation",2391
Extra Element,1185,D,"implementation, math",6277
Email from Polycarp,1185,B,"implementation, strings",12451
Parallel Universes (Easy),1184,D1,implementation,2424
Heidi and the Turing Test (Easy),1184,C1,implementation,2183
Candy Box (hard version),1183,G,"greedy, implementation, sortings",2200
Subsequences (easy version),1183,E,"dp, graphs, implementation, shortest paths",4285
Nearest Interesting Number,1183,A,implementation,23424
Complete Mirror,1182,D,"constructive algorithms, dfs and similar, dp, hashing, implementation, trees",746
Plus from Picture,1182,B,"dfs and similar, implementation, strings",10557
Irrigation,1181,D,"binary search, data structures, implementation, sortings, trees, two pointers",1877
Flag,1181,C,"brute force, combinatorics, dp, implementation",2962
Split a Number,1181,B,"greedy, implementation, strings",6062
Nick and Array,1180,B,"greedy, implementation",9100
Alex and a Rhombus,1180,A,"dp, implementation, math",23012
Serge and Dining Room,1179,C,"binary search, data structures, graph matchings, greedy, implementation, math, trees",1822
Valeriy and Deque,1179,A,"data structures, implementation",9639
Digits Sequence (Hard Edition),1177,B,"binary search, divide and conquer, implementation",2293
Digits Sequence (Easy Edition),1177,A,implementation,5106
Destroy it!,1176,F,"dp, implementation, sortings",1646
Lose it!,1176,C,"dp, greedy, implementation",13453
Divide it!,1176,A,"brute force, greedy, implementation",21030
Minimal Segment Cover,1175,E,"data structures, dfs and similar, divide and conquer, dp, greedy, implementation, trees",2917
Catch Overflow!,1175,B,"data structures, expression parsing, implementation",9598
From Hero to Zero,1175,A,"implementation, math",16922
Ehab and the Big Finale,1174,F,"constructive algorithms, divide and conquer, graphs, implementation, interactive, trees",1322
Nauuo and Cards,1172,A,"greedy, implementation",4626
Decoding of Integer Sequences,1170,D,"*special, data structures, implementation",395
Minus and Minus Give Plus,1170,C,"*special, implementation, strings",739
Bad Days,1170,B,"*special, implementation",950
Pairs,1169,B,"graphs, implementation",8840
Circle Metro,1169,A,"implementation, math",11235
Anagram Paths,1168,D,"dp, implementation, trees",276
Microtransactions (hard version),1165,F2,"binary search, greedy, implementation",1921
Remainder,1165,A,"implementation, math",13092
Power Transmission (Hard Edition),1163,C2,"data structures, geometry, implementation, math",3099
Cat Party (Hard Edition),1163,B2,"data structures, implementation",6316
Cat Party (Easy Edition),1163,B1,"data structures, implementation",6345
Zoning Restrictions Again,1162,A,implementation,7669
Expansion coefficient of the array,1159,B,"implementation, math",6739
A pile of stones,1159,A,"implementation, math",11877
The Party and Sweets,1158,A,"binary search, constructive algorithms, greedy, implementation, math, sortings, two pointers",6433
Reachable Numbers,1157,A,implementation,14580
Optimizer,1156,G,"graphs, greedy, hashing, implementation",108
Ugly Pairs,1156,B,"dfs and similar, greedy, implementation, sortings, strings",5618
Game with Telephone Numbers,1155,B,"games, greedy, implementation",11055
Reverse a Substring,1155,A,"implementation, sortings, strings",11904
Two Teams,1154,E,"data structures, implementation, sortings",5433
Gourmet Cat,1154,C,"implementation, math",9644
Neko Finds Grapes,1152,A,"greedy, implementation, math",14183
Tiling Challenge,1150,B,"greedy, implementation",10231
Stock Arbitraging,1150,A,"greedy, implementation",11010
Tree Generator™,1149,C,"data structures, implementation, trees",1090
Three Religions,1149,B,"dp, implementation, strings",1789
Hot is Cold,1146,E,"bitmasks, data structures, divide and conquer, implementation",790
"Hate ""A""",1146,B,"implementation, strings",7574
"Love ""A""",1146,A,"implementation, strings",20346
Pigeon d'Or,1145,D,implementation,1083
Thanos Sort,1145,A,implementation,8345
Parity Alternated Deletions,1144,B,"greedy, implementation, sortings",16184
Diverse Strings,1144,A,"implementation, strings",18136
The Doors,1143,A,implementation,12663
Colored Boots,1141,D,"greedy, implementation",7822
Maximal Continuous Rest,1141,B,implementation,19987
Game 23,1141,A,"implementation, math",27176
Good String,1140,B,"implementation, strings",10887
Detective Book,1140,A,implementation,11795
Chocolates,1139,B,"greedy, implementation",14881
Even Substrings,1139,A,"implementation, strings",16093
Sushi for Two,1138,A,"binary search, greedy, implementation",16412
Museums Tour,1137,C,"dp, graphs, implementation",1073
Skyscrapers,1137,A,"implementation, sortings",4087
Nastya Is Reading a Book,1136,A,implementation,15803
Middle of the Contest,1133,A,implementation,15656
Regular Bracket Sequence,1132,A,"greedy, implementation",9167
Draw!,1131,B,"greedy, implementation",9204
Be Positive,1130,A,implementation,11208
System Testing,1121,C,implementation,1903
Mike and Children,1121,B,"brute force, implementation",8214
Technogoblet of Fire,1121,A,"implementation, sortings",6948
Once in a casino,1120,B,"constructive algorithms, greedy, implementation, math",392
Diana and Liana,1120,A,"greedy, implementation, two pointers",1585
Get Ready for the Battle,1119,G,"constructive algorithms, implementation",396
Ramesses and Corner Inversion,1119,C,"constructive algorithms, greedy, implementation, math",6464
Ilya and a Colorful Walk,1119,A,"greedy, implementation",10257
Yet Another Ball Problem,1118,E,"constructive algorithms, implementation",3756
Palindromic Matrix,1118,C,"constructive algorithms, implementation",5315
Tanya and Candies,1118,B,implementation,11205
Best Subsegment,1117,A,"implementation, math",10553
Trailing Loves (or L'oeufs?),1114,C,"brute force, implementation, math, number theory",7049
Got Any Grapes?,1114,A,"brute force, greedy, implementation",17926
Average Superhero Gang Power ,1111,B,"brute force, implementation, math",5827
Superhero Transformation,1111,A,"implementation, strings",16204
Sasha and a Patient Friend,1109,C,"binary search, data structures, implementation",230
Sasha and a Bit of Relax,1109,A,"dp, implementation",7981
Array and Segments (Hard version),1108,E2,"data structures, implementation",2014
Array and Segments (Easy version),1108,E1,"brute force, greedy, implementation",4234
Two distinct points,1108,A,implementation,20663
Compression,1107,D,"dp, implementation, math, number theory",3623
Lunar New Year and Number Division,1106,C,"greedy, implementation, math, sortings",13883
Lunar New Year and Food Ordering,1106,B,"data structures, implementation",6611
Lunar New Year and Cross Counting,1106,A,implementation,12159
Kilani and the Game,1105,D,"dfs and similar, graphs, implementation, shortest paths",3867
Zuhair and Strings,1105,B,"brute force, implementation, strings",9641
Salem and Sticks ,1105,A,"brute force, implementation",10545
Game with string,1104,B,"data structures, implementation, math",13937
Splitting into digits,1104,A,"constructive algorithms, implementation, math",14962
Grid game,1103,A,"constructive algorithms, implementation",9336
Polycarp's New Job,1101,E,implementation,7590
Accordion,1101,B,"greedy, implementation",10162
Build a Contest,1100,B,"data structures, implementation",10645
Roman and Browser,1100,A,implementation,9867
Postcard,1099,C,"constructive algorithms, implementation",8758
Snowball,1099,A,implementation,12134
Fedya the Potter,1098,E,"binary search, implementation, math, number theory",195
Yuhao and a Parenthesis,1097,C,"greedy, implementation",7739
Gennady and a Card Game,1097,A,"brute force, implementation",34673
Find Divisible,1096,A,"greedy, implementation, math",17501
Almost Regular Bracket Sequence,1095,E,implementation,3470
Circular Dance,1095,D,implementation,6772
Array Stabilization,1095,B,implementation,19866
Repeating Cipher,1095,A,implementation,27418
Great Vova Wall (Version 2),1092,D2,"data structures, implementation",2673
Great Vova Wall (Version 1),1092,D1,"greedy, implementation, math",3913
Uniform String,1092,A,implementation,14874
New Year and the Acquaintance Estimation,1091,E,"binary search, data structures, graphs, greedy, implementation, math, sortings",947
